{
  "collection_id": "validation",
  "collection_name": "Cross-Category Validation Collection",
  "description": "Validation collection wired to real files in local-media/assets. All artifacts are body material; generated films choose randomized B-roll/X-roll bookends at runtime.",
  "version": "1.0.0",
  "created_at": "2026-07-02T00:00:00Z",
  "updated_at": "2026-07-03T00:00:00Z",
  "runtime_rules": {
    "min_duration_seconds": 35,
    "max_duration_seconds": 120,
    "allow_repeat_artifacts": false,
    "save_generated_films": true
  },
  "artifact_counts": {
    "total": 14,
    "a_roll": 6,
    "b_roll": 4,
    "x_roll": 4
  },
  "artifacts": [
    {
      "artifact_id": "val_av_001",
      "artifact_type": "A-roll",
      "role": "body",
      "filename": "a-roll/First_skate.mov",
      "duration_seconds": 5.136667,
      "title": "First skate",
      "mood": "hopeful",
      "pacing": "medium",
      "tags": [
        "skateboard",
        "outdoor",
        "movement",
        "personal"
      ],
      "theme": [
        "skateboarding",
        "first-attempt",
        "motion"
      ],
      "weight": 0.7,
      "dominant_lines": "diagonal",
      "geography": "local",
      "can_repeat": false,
      "must_not_follow": []
    },
    {
      "artifact_id": "val_av_002",
      "artifact_type": "A-roll",
      "role": "body",
      "filename": "a-roll/SF_Zoo.MOV",
      "duration_seconds": 12.348333,
      "title": "San Francisco zoo",
      "mood": "reflective",
      "pacing": "slow",
      "tags": [
        "zoo",
        "san-francisco",
        "outdoor",
        "visit"
      ],
      "theme": [
        "animals",
        "public-space",
        "observation"
      ],
      "weight": 0.6,
      "dominant_lines": "mixed",
      "geography": "San Francisco",
      "can_repeat": false,
      "must_not_follow": []
    },
    {
      "artifact_id": "val_av_003",
      "artifact_type": "A-roll",
      "role": "body",
      "filename": "a-roll/chick_stir_fry.mov",
      "duration_seconds": 7.705,
      "title": "Chicken stir fry",
      "mood": "neutral",
      "pacing": "medium",
      "tags": [
        "cooking",
        "kitchen",
        "hands",
        "sizzle"
      ],
      "theme": [
        "food",
        "domestic-labor",
        "preparation"
      ],
      "weight": 0.6,
      "dominant_lines": "mixed",
      "geography": "kitchen",
      "can_repeat": false,
      "must_not_follow": []
    },
    {
      "artifact_id": "val_av_004",
      "artifact_type": "A-roll",
      "role": "body",
      "filename": "a-roll/robotic_arm.mov",
      "duration_seconds": 11.903333,
      "title": "Robotic arm",
      "mood": "tense",
      "pacing": "slow",
      "tags": [
        "robot",
        "machine",
        "arm",
        "controlled-motion"
      ],
      "theme": [
        "technology",
        "automation",
        "precision"
      ],
      "weight": 0.8,
      "dominant_lines": "vertical",
      "geography": "lab",
      "can_repeat": false,
      "must_not_follow": []
    },
    {
      "artifact_id": "val_av_005",
      "artifact_type": "A-roll",
      "role": "body",
      "filename": "a-roll/gallery_monkey.mov",
      "duration_seconds": 12.64,
      "title": "Gallery monkey",
      "mood": "triumphant",
      "pacing": "medium",
      "tags": [
        "gallery",
        "monkey",
        "display",
        "interior"
      ],
      "theme": [
        "art-space",
        "animal-image",
        "looking"
      ],
      "weight": 0.6,
      "dominant_lines": "vertical",
      "geography": "gallery",
      "can_repeat": false,
      "must_not_follow": []
    },
    {
      "artifact_id": "val_av_006",
      "artifact_type": "A-roll",
      "role": "body",
      "filename": "a-roll/skate_boarding.mov",
      "duration_seconds": 11.261678,
      "title": "Skate boarding",
      "mood": "urgent",
      "pacing": "fast",
      "tags": [
        "skateboard",
        "street",
        "movement",
        "youth"
      ],
      "theme": [
        "skateboarding",
        "street",
        "motion"
      ],
      "weight": 0.7,
      "dominant_lines": "diagonal",
      "geography": "street",
      "can_repeat": false,
      "must_not_follow": []
    },
    {
      "artifact_id": "val_bv_001",
      "artifact_type": "B-roll",
      "role": "body",
      "filename": "b-roll/warship_cruising.mp4",
      "duration_seconds": 10.09,
      "title": "Warship cruising",
      "mood": "somber",
      "pacing": "slow",
      "tags": [
        "warship",
        "ocean",
        "vessel",
        "horizontal"
      ],
      "theme": [
        "military",
        "sea",
        "power"
      ],
      "weight": 0.8,
      "dominant_lines": "horizontal",
      "geography": "open water",
      "can_repeat": false,
      "must_not_follow": []
    },
    {
      "artifact_id": "val_bv_002",
      "artifact_type": "B-roll",
      "role": "body",
      "filename": "b-roll/waves_sunset.mp4",
      "duration_seconds": 9.033333,
      "title": "Waves at sunset",
      "mood": "melancholic",
      "pacing": "slow",
      "tags": [
        "waves",
        "sunset",
        "water",
        "horizon"
      ],
      "theme": [
        "ocean",
        "sunset",
        "weather"
      ],
      "weight": 0.7,
      "dominant_lines": "horizontal",
      "geography": "coast",
      "can_repeat": false,
      "must_not_follow": [
        "val_bv_001"
      ]
    },
    {
      "artifact_id": "val_bv_003",
      "artifact_type": "B-roll",
      "role": "body",
      "filename": "b-roll/plane_drop.mp4",
      "duration_seconds": 8.133333,
      "title": "Plane drop",
      "mood": "urgent",
      "pacing": "fast",
      "tags": [
        "plane",
        "drop",
        "sky",
        "motion"
      ],
      "theme": [
        "flight",
        "risk",
        "sky"
      ],
      "weight": 0.7,
      "dominant_lines": "diagonal",
      "geography": "sky",
      "can_repeat": false,
      "must_not_follow": []
    },
    {
      "artifact_id": "val_bv_004",
      "artifact_type": "B-roll",
      "role": "body",
      "filename": "b-roll/colorful_ballerina.mp4",
      "duration_seconds": 9.008984,
      "title": "Colorful ballerina",
      "mood": "triumphant",
      "pacing": "medium",
      "tags": [
        "ballerina",
        "dance",
        "color",
        "stage"
      ],
      "theme": [
        "dance",
        "performance",
        "color"
      ],
      "weight": 0.6,
      "dominant_lines": "curved",
      "geography": "stage",
      "can_repeat": false,
      "must_not_follow": []
    },
    {
      "artifact_id": "val_xa_001",
      "artifact_type": "X-roll",
      "role": "body",
      "filename": "x-roll/piano_sound.wav",
      "duration_seconds": 10.105261,
      "title": "Piano sound",
      "mood": "reflective",
      "pacing": "slow",
      "tags": [
        "piano",
        "music",
        "audio",
        "melody"
      ],
      "theme": [
        "music",
        "piano",
        "sound"
      ],
      "weight": 0.6,
      "geography": "studio",
      "can_repeat": false,
      "must_not_follow": []
    },
    {
      "artifact_id": "val_xa_002",
      "artifact_type": "X-roll",
      "role": "body",
      "filename": "x-roll/water_stream.wav",
      "duration_seconds": 10.096625,
      "title": "Water stream",
      "mood": "neutral",
      "pacing": "slow",
      "tags": [
        "water",
        "stream",
        "ambient",
        "flow"
      ],
      "theme": [
        "water",
        "nature",
        "sound"
      ],
      "weight": 0.5,
      "geography": "stream",
      "can_repeat": false,
      "must_not_follow": []
    },
    {
      "artifact_id": "val_xa_003",
      "artifact_type": "X-roll",
      "role": "body",
      "filename": "x-roll/war_bong.wav",
      "duration_seconds": 6.615979,
      "title": "War bong",
      "mood": "tense",
      "pacing": "fast",
      "tags": [
        "percussion",
        "impact",
        "warning",
        "audio"
      ],
      "theme": [
        "percussion",
        "alarm",
        "impact"
      ],
      "weight": 0.7,
      "geography": "sound-library",
      "can_repeat": false,
      "must_not_follow": []
    },
    {
      "artifact_id": "val_xa_004",
      "artifact_type": "X-roll",
      "role": "body",
      "filename": "x-roll/birds_call.wav",
      "duration_seconds": 10.478776,
      "title": "Bird calls",
      "mood": "hopeful",
      "pacing": "medium",
      "tags": [
        "birds",
        "calls",
        "ambient",
        "nature"
      ],
      "theme": [
        "birds",
        "nature",
        "sound"
      ],
      "weight": 0.6,
      "geography": "outdoors",
      "can_repeat": false,
      "must_not_follow": []
    }
  ]
}
